{
  "schema_version": "1.1.0",
  "proposal_id": "ca.sco.segment_500_plus.property_type_nonconforming_row_handling_policy_v1_2_real_source_execution",
  "proposal_version": "1.1.0",
  "proposal_status": "PROPOSAL_ONLY_NOT_AUTHORIZED",
  "prepared_on": "2026-09-17",
  "jurisdiction": "CA",
  "source_id": "ca.sco.unclaimed_property.bulk",
  "source_segment_id": "ca.sco.unclaimed_property.bulk.500_plus",
  "supersedes_proposal_version": "1.0.0",
  "historical_proposal_path": "sources/proposals/ca_sco_segment_500_plus.property_type_nonconforming_row_handling_policy_v1_2_real_source_execution.v1.json",
  "base_state": {
    "branch": "m3-ca-sco-transport-archive-layout-baseline-adoption",
    "head_sha": "6188806e58ac87ccde7b8d6d20dcb2bbbec67c28",
    "head_ci_run": "35210199280",
    "baseline_adoption_action": "IMPLEMENT_PROPERTY_TYPE_TRANSPORT_AND_ARCHIVE_LAYOUT_BASELINE_ADOPTION",
    "baseline_adopted": true,
    "decision_record": "D-008",
    "accepted_design_policy": "WHOLE_SOURCE_STOP",
    "accepted_implementation_strategy": "ADDITIVE_VERSIONED_CONTROL_DISPOSITION",
    "runner_path": "scripts/ca_sco_property_type_semantic_verification.py",
    "execution_schema_path": "schemas/common/property_type_semantic_verification_execution.v1_2.schema.json",
    "execution_schema_version": "1.2.0"
  },
  "adopted_transport_baseline": {
    "expected_length": 162560390,
    "expected_etag": "\"222dd79f04c2a0a8fff166b01c8da746\"",
    "canonical_members": [
      {"name": "From_500_To_Beyond_1_of_4.csv", "local_header_offset": 0},
      {"name": "From_500_To_Beyond_2_of_4.csv", "local_header_offset": 59745428},
      {"name": "From_500_To_Beyond_3_of_4.csv", "local_header_offset": 96861315},
      {"name": "From_500_To_Beyond_4_of_4.csv", "local_header_offset": 134172553}
    ]
  },
  "historical_authorization_state": {
    "all_prior_execution_approvals_consumed": true,
    "all_prior_privacy_approvals_consumed": true,
    "approvals_reusable": false,
    "consumed_approval_refs": [
      "OWNER_CHAT_APPROVAL_2026-09-15_PROPERTY_TYPE_SEMANTIC_EXECUTION_BOUNDED",
      "OWNER_CHAT_APPROVAL_2026-09-15_PROPERTY_TYPE_TRANSIENT_ROW_PRIVACY_BOUNDED",
      "APPROVE_SECOND_PROPERTY_TYPE_SEMANTIC_EXECUTION_BOUNDED",
      "APPROVE_SECOND_PROPERTY_TYPE_TRANSIENT_ROW_PRIVACY_BOUNDED"
    ],
    "historical_v1_1_evidence_preserved": true,
    "semantic_compatibility_resolved": false
  },
  "fresh_authorization_requirements": {
    "execution_approval_status": "REQUIRED_NOT_GRANTED",
    "execution_approval_ref": null,
    "transient_row_privacy_approval_status": "REQUIRED_NOT_GRANTED",
    "transient_row_privacy_approval_ref": null,
    "network_workflow_creation_authorized": false,
    "real_execution_authorized": false,
    "single_use_approval_required": true,
    "proposal_review_gate": "HUMAN_PROPERTY_TYPE_NONCONFORMING_ROW_HANDLING_POLICY_V1_2_REAL_SOURCE_EXECUTION_PROPOSAL_REFRESH_REVIEW",
    "authorization_gate": "HUMAN_PROPERTY_TYPE_NONCONFORMING_ROW_HANDLING_POLICY_V1_2_REAL_SOURCE_EXECUTION_AUTHORIZATION"
  },
  "execution_question": {
    "field": "PROPERTY_TYPE",
    "question_id": "VERIFY_V1_2_REAL_SOURCE_FAIL_CLOSED_CONTROL_DISPOSITION_BOUNDED",
    "question": "Using the human-reviewed v1.2.0 runner and the unchanged deterministic bounded prefix sample, does a separately authorized real-source execution conform to the v1.2 execution contract, including the exact D-008 control_disposition mapping if PROPERTY_TYPE_FORMAT_UNEXPECTED occurs?",
    "proof_boundary": "ONE_BOUNDED_EXECUTION_ONLY_DOES_NOT_PROVE_GLOBAL_SOURCE_SEMANTICS_FREQUENCY_OR_FUTURE_COMPATIBILITY",
    "hidden_source_value_inference_allowed": false,
    "production_classification_activation_allowed": false,
    "specific_real_source_outcome_precommitted": false
  },
  "sample_plan": {
    "selection_mode": "FIRST_COMPLETE_DATA_ROWS_AFTER_VERIFIED_HEADER_PER_CANONICAL_MEMBER",
    "canonical_member_count": 4,
    "canonical_members": [
      {"name": "From_500_To_Beyond_1_of_4.csv", "local_header_offset": 0},
      {"name": "From_500_To_Beyond_2_of_4.csv", "local_header_offset": 59745428},
      {"name": "From_500_To_Beyond_3_of_4.csv", "local_header_offset": 96861315},
      {"name": "From_500_To_Beyond_4_of_4.csv", "local_header_offset": 134172553}
    ],
    "data_rows_max_per_member": 4,
    "data_rows_max_total": 16,
    "header_rows_counted_as_data": false,
    "representativeness_claimed": false,
    "sample_bias_note": "Prefix sampling is deterministic and privacy-minimized; it is not statistically representative."
  },
  "transport_caps": {
    "head_requests_max": 1,
    "range_requests_max": 4,
    "http_requests_max_total": 5,
    "range_response_bytes_max_each": 131072,
    "source_response_body_bytes_max_total": 524288,
    "uncompressed_transient_bytes_max_each": 262144,
    "uncompressed_transient_bytes_max_total": 1048576,
    "logical_record_bytes_max": 32768,
    "additional_range_allowed": false,
    "full_body_fallback_allowed": false,
    "automatic_widening_allowed": false,
    "automatic_retry_allowed": false
  },
  "row_processing_controls": {
    "expected_column_count": 25,
    "property_type_column_index_zero_based": 1,
    "property_type_code_shape_regex": "^(?:[A-Z]{2}[0-9]{2}|ZZZZ)$",
    "official_insurance_codes": ["IN01", "IN02", "IN03", "IN04", "IN05", "IN06", "IN07", "IN08", "IN99"],
    "trimming_allowed": false,
    "uppercasing_allowed": false,
    "normalization_allowed": false,
    "regex_relaxation_allowed": false,
    "parser_change_allowed": false,
    "projector_change_allowed": false
  },
  "v1_2_outcome_contract": {
    "execution_schema_version": "1.2.0",
    "property_type_format_unexpected_legacy_status": "STOPPED_FAIL_CLOSED",
    "property_type_format_unexpected_legacy_stop_reason": "PROPERTY_TYPE_FORMAT_UNEXPECTED",
    "property_type_format_unexpected_control_status_code": "PROPERTY_TYPE_NONCONFORMING_STOPPED",
    "property_type_format_unexpected_control_reason_code": "PROPERTY_TYPE_STRUCTURAL_NONCONFORMANCE",
    "unrelated_stop_control_disposition": null,
    "non_stopped_control_disposition": null,
    "source_continuation_after_property_type_format_unexpected": false,
    "later_members_requested_after_trigger": false,
    "silent_row_skip_allowed": false,
    "specific_real_source_outcome_required_for_proposal_acceptance": false
  },
  "privacy_controls": {
    "transient_full_row_bytes_may_be_observed_only_after_fresh_privacy_approval": true,
    "memory_only": true,
    "transient_buffer_retention_days": 0,
    "immediate_disposal": true,
    "raw_body_persistence": false,
    "full_row_persistence": false,
    "property_id_persistence": false,
    "owner_holder_persistence": false,
    "per_row_property_type_persistence": false,
    "offending_bytes_persistence": false,
    "offending_value_hash_persistence": false,
    "offending_value_length_persistence": false,
    "record_values_in_logs": false,
    "real_row_quarantine_persistence": false,
    "row_specific_human_inspection": false,
    "privacy_expansion_required": false,
    "control_disposition_allowed_persisted_fields": ["status_code", "reason_code"],
    "control_disposition_source_value_bearing_fields_allowed": false,
    "derived_summary_persistence_allowed": true,
    "allowed_persisted_derived_fields": [
      "sample_rows_examined",
      "rows_examined_per_member",
      "distinct_property_type_codes",
      "distinct_insurance_codes",
      "control_disposition",
      "semantic_result_status",
      "stop_reason"
    ]
  },
  "workflow_plan": {
    "planned_path": ".github/workflows/ca-sco-property-type-semantic-verification-once.yml",
    "proposal_creates_workflow": false,
    "create_only_after_fresh_authorization": true,
    "one_shot_only": true,
    "branch_pinned_required": true,
    "execution_approval_ref_required": true,
    "privacy_approval_ref_required": true,
    "remove_after_execution": true
  },
  "preparation_state": {
    "runtime_code_modified": false,
    "execution_schema_v1_2_modified": false,
    "source_policy_modified": false,
    "registry_modified": false,
    "network_workflow_created": false,
    "network_request_performed": false,
    "source_body_access_performed": false,
    "real_row_or_field_access_performed": false,
    "execution_performed": false,
    "approval_token_created_or_granted": false
  },
  "safety_state": {
    "source_policy_status": "PROPOSED",
    "registry_enabled": false,
    "registry_approved_for_use": false,
    "approved_real_sources": 0,
    "source_continuation_authorized": false,
    "privacy_expansion_authorized": false,
    "semantic_compatibility_resolved": false,
    "production_classification_active": false,
    "identity_resolution_allowed": false,
    "genealogy_allowed": false,
    "beneficiary_matching_allowed": false,
    "outreach_allowed": false,
    "claim_submission_allowed": false
  },
  "acceptance_criteria": [
    "PROPOSAL_VALIDATES_AGAINST_VERSIONED_SCHEMA",
    "BASE_PINNED_TO_CI_GREEN_HUMAN_REVIEWED_V1_2_CHECKPOINT",
    "FRESH_EXECUTION_AND_PRIVACY_APPROVALS_REQUIRED_AND_NOT_GRANTED",
    "ALL_PRIOR_APPROVALS_REMAIN_CONSUMED_AND_NON_REUSABLE",
    "RUNNER_AND_V1_2_EXECUTION_SCHEMA_REMAIN_UNMODIFIED",
    "SAMPLE_AND_TRANSPORT_CAPS_REMAIN_UNCHANGED",
    "PROPERTY_TYPE_VALIDATION_REGEX_PARSER_PROJECTOR_AND_NO_NORMALIZATION_REMAIN_UNCHANGED",
    "D008_CONTROL_DISPOSITION_MAPPING_REMAINS_EXACT_AND_FAIL_CLOSED",
    "NO_REAL_SOURCE_OUTCOME_IS_PRECOMMITTED_OR_INFERRED",
    "PRIVACY_SCOPE_DOES_NOT_EXPAND",
    "SOURCE_CONTINUATION_REMAINS_FALSE",
    "PROPOSAL_PREPARATION_PERFORMS_NO_NETWORK_OR_SOURCE_ACCESS",
    "SOURCE_POLICY_REGISTRY_PRODUCTION_CLASSIFICATION_AND_DOWNSTREAM_GATES_REMAIN_CLOSED"
  ],
  "next_gate": "HUMAN_PROPERTY_TYPE_NONCONFORMING_ROW_HANDLING_POLICY_V1_2_REAL_SOURCE_EXECUTION_PROPOSAL_REFRESH_REVIEW"
}
